{
 "kader": "bio2-domeinen",
 "titel": "BIO 2.0, beleidsdomeinen",
 "versie": "1.1",
 "toelichting": "Vijftien beleidsdomeinen die de overheidsmaatregelen van BIO 2.0 groeperen naar het beleidsdocument waarin ze thuishoren, van informatiebeveiligingsbeleid tot leveranciersbeheer. Een afgeleide van bio2.json, bedoeld voor wie beleid schrijft of toetst; elk control-id verwijst naar een maatregel daar. Beleidsdomeinen gebaseerd op BIO2 v1.3. Elk domein groepeert de relevante BIO2-controls voor een materie-specifiek beleidsdocument.",
 "bron": {
  "naam": "Security Commons NL, afgeleid van BIO 2.0 (CIP)",
  "versie": "1.1",
  "licentie": "EUPL-1.2 (de indeling); de maatregelen zelf zijn van het CIP",
  "opgehaald": "2026-09-02",
  "herkomst": "eenmalig overgenomen uit security-commons-nl/cisochat, data/domeinen.json",
  "commit": "ce9b88b8aebc8e5a64705db049d1c3efba31e7ca",
  "let_op": "Versie 1.1 (13-10-2026): bijgewerkt naar de nummering van BIO 2.0 versie 1.3. 5.25.01 is 5.26.02 geworden, 5.26.01 is vervallen als overheidsmaatregel; 5.10.02, 5.10.03, 5.20.04 t/m 5.20.06, 5.21.05, 6.01.01, 6.03.04, 8.24.02, 8.24.04 en 8.24.05 zijn toegevoegd bij het domein van hun ISO-beheersmaatregel."
 },
 "domeinen": [
  {
   "id": "ib-beleid",
   "titel": "Informatiebeveiligingsbeleid",
   "omschrijving": "Overkoepelend beleid voor informatiebeveiliging: uitgangspunten, verantwoordelijkheden en jaarlijkse evaluatiecyclus.",
   "controls": [
    "5.01.01",
    "5.01.02"
   ]
  },
  {
   "id": "organisatie-rollen",
   "titel": "Organisatie & rollen",
   "omschrijving": "Rollen en verantwoordelijkheden voor informatiebeveiliging, CISO-aanstelling, functiescheiding en managementverplichtingen.",
   "controls": [
    "5.02.01",
    "5.02.02",
    "5.03.01",
    "5.04.01",
    "5.05.01",
    "5.06.01",
    "5.07.01",
    "5.08.01"
   ]
  },
  {
   "id": "bedrijfsmiddelenbeheer",
   "titel": "Bedrijfsmiddelenbeheer & informatieclassificatie",
   "omschrijving": "Inventarisatie van informatie en systemen, classificatie, labeling en veilige overdracht van informatie.",
   "controls": [
    "5.09.01",
    "5.10.01",
    "5.10.02",
    "5.10.03",
    "5.11.01",
    "5.12.01",
    "5.13.01",
    "5.14.01",
    "5.14.02",
    "5.14.03",
    "5.14.04",
    "5.14.05"
   ]
  },
  {
   "id": "toegangsbeveiliging",
   "titel": "Toegangsbeveiliging",
   "omschrijving": "Beleid voor logische toegang: identiteitsbeheer, authenticatie (MFA), wachtwoordbeheer en toegangsrechten.",
   "controls": [
    "5.15.01",
    "5.16.01",
    "5.16.02",
    "5.17.01",
    "5.17.02",
    "5.17.03",
    "5.18.01",
    "5.18.02"
   ]
  },
  {
   "id": "leveranciersmanagement",
   "titel": "Leveranciersmanagement",
   "omschrijving": "Informatiebeveiliging in leveranciersrelaties: inkoopeisen, contracteisen, ketenbeheer en Cloud Service Providers.",
   "controls": [
    "5.19.01",
    "5.20.01",
    "5.20.02",
    "5.20.03",
    "5.20.04",
    "5.20.05",
    "5.20.06",
    "5.21.02",
    "5.21.03",
    "5.21.04",
    "5.21.05",
    "5.22.01",
    "5.22.02",
    "5.23.01"
   ]
  },
  {
   "id": "incidentbeheer",
   "titel": "Incidentbeheer",
   "omschrijving": "Meldloket, incidentprocedure, meldplicht (Cbw/CSIRT), CVD-procedure en lessons learned.",
   "controls": [
    "5.24.01",
    "5.24.02",
    "5.24.03",
    "5.24.04",
    "5.24.05",
    "5.24.07",
    "5.24.08",
    "5.26.02",
    "5.27.01",
    "5.27.02",
    "5.28.01"
   ]
  },
  {
   "id": "bedrijfscontinuiteit",
   "titel": "Bedrijfscontinuiteit",
   "omschrijving": "Continuiteitsplannen, back-upbeleid, herstelprocedures en kritieke systemen.",
   "controls": [
    "5.29.01",
    "5.30.01",
    "5.30.02",
    "8.13.01",
    "8.13.02",
    "8.13.03",
    "8.13.04"
   ]
  },
  {
   "id": "compliancy-audit",
   "titel": "Compliancy & audit",
   "omschrijving": "Auditplan, In Control Verklaring (ICV), bewaarplicht en naleving van wet- en regelgeving.",
   "controls": [
    "5.31.01",
    "5.33.01",
    "5.36.01"
   ]
  },
  {
   "id": "personeel-bewustzijn",
   "titel": "Personeel & beveiligingsbewustzijn",
   "omschrijving": "Screening, arbeidsvoorwaarden, bewustwordingsprogrammas en verplichte trainingen voor alle medewerkers.",
   "controls": [
    "6.01.01",
    "6.02.01",
    "6.03.01",
    "6.03.02",
    "6.03.03",
    "6.03.04",
    "6.04.01",
    "6.05.01",
    "6.06.01",
    "6.07.01",
    "6.08.01"
   ]
  },
  {
   "id": "fysieke-beveiliging",
   "titel": "Fysieke beveiliging",
   "omschrijving": "Fysieke beveiligingszones, toegangscontrole, clean desk, verwijdering van media en transport van informatie.",
   "controls": [
    "7.01.02",
    "7.02.01",
    "7.07.01",
    "7.10.01",
    "7.10.02",
    "7.10.03",
    "7.11.01",
    "7.12.01",
    "7.13.01",
    "7.14.01"
   ]
  },
  {
   "id": "mobiel-werken",
   "titel": "Mobiel werken & telewerken",
   "omschrijving": "Beleid voor mobiele apparatuur, zero footprint, MDM/MAM en veilig thuiswerken.",
   "controls": [
    "8.01.01",
    "8.01.02"
   ]
  },
  {
   "id": "technische-beveiliging",
   "titel": "Technische beveiligingsmaatregelen",
   "omschrijving": "Netwerksegmentatie, patchmanagement, malwareprotectie, kwetsbaarheidsbeheer en penetratietesten.",
   "controls": [
    "8.03.01",
    "8.03.02",
    "8.04.01",
    "8.07.01",
    "8.07.02",
    "8.07.03",
    "8.07.04",
    "8.08.01",
    "8.08.02",
    "8.08.03",
    "8.08.04",
    "8.08.05"
   ]
  },
  {
   "id": "logging-monitoring",
   "titel": "Logging & monitoring",
   "omschrijving": "Logbeleid, SIEM, SOC-monitoring, bewaartermijnen en detectie van afwijkingen.",
   "controls": [
    "8.15.01",
    "8.15.02",
    "8.15.03",
    "8.15.04",
    "8.15.05",
    "8.15.06",
    "8.16.01",
    "8.16.02",
    "8.16.03",
    "8.16.04",
    "8.21.01",
    "8.21.02",
    "8.21.03",
    "8.21.04"
   ]
  },
  {
   "id": "cryptografie",
   "titel": "Cryptografie",
   "omschrijving": "Cryptografiebeleid: wanneer toepassen, sleutelbeheer, normen (Forum Standaardisatie, NCSC-advies).",
   "controls": [
    "8.24.01",
    "8.24.02",
    "8.24.04",
    "8.24.05"
   ]
  },
  {
   "id": "systeemontwikkeling",
   "titel": "Systeemontwikkeling & wijzigingsbeheer",
   "omschrijving": "Security by design, testbeleid, wijzigingsbeheer en uitbestede ontwikkeling.",
   "controls": [
    "8.25.01",
    "8.27.01",
    "8.29.01",
    "8.30.01",
    "8.31.01",
    "8.31.02",
    "8.32.01",
    "8.32.02"
   ]
  }
 ],
 "vingerafdruk": "303dc2a727d1389bf03f2dcd62a47b6b5f4e7d7540a775c25ddd4456e8b2a16d"
}
